{
 "$schema": "http://json-schema.org/draft-07/schema#",
 "title": "ScoutDecisionsResponse",
 "type": "object",
 "required": [
  "decisions",
  "count",
  "generated_at",
  "retention_days"
 ],
 "properties": {
  "decisions": {
   "type": "array",
   "items": {
    "type": "object",
    "required": [
     "id",
     "decision",
     "decided_at"
    ],
    "properties": {
     "id": {
      "type": "string"
     },
     "title": {
      "type": [
       "string",
       "null"
      ]
     },
     "source_url": {
      "type": [
       "string",
       "null"
      ]
     },
     "feed": {
      "type": [
       "string",
       "null"
      ]
     },
     "decision": {
      "type": "string",
      "enum": [
       "approve",
       "reject"
      ]
     },
     "decided_at": {
      "type": [
       "string",
       "null"
      ]
     },
     "decided_by": {
      "type": [
       "string",
       "null"
      ]
     },
     "note": {
      "type": [
       "string",
       "null"
      ]
     },
     "activity_id": {
      "type": [
       "string",
       "null"
      ]
     },
     "approved_via": {
      "type": [
       "string",
       "null"
      ]
     },
     "reviewed": {
      "type": [
       "string",
       "null"
      ]
     }
    }
   }
  },
  "count": {
   "type": "integer",
   "minimum": 0
  },
  "generated_at": {
   "type": "string",
   "pattern": "^\\d{4}-\\d{2}-\\d{2}T\\d{2}:\\d{2}:\\d{2}Z$"
  },
  "retention_days": {
   "type": "integer",
   "minimum": 1
  }
 }
}