{
 "decisions": [
  {
   "id": "a11221491bc63a7c",
   "title": "Coping Strategies for Students Posters (Free Printables)",
   "source_url": "https://www.weareteachers.com/coping-strategies-for-students-posters-free-printables/?utm_source=rss&utm_medium=rss&utm_campaign=coping-strategies-for-students-posters-free-printables",
   "feed": "WeAreTeachers",
   "decision": "approve",
   "decided_at": "2026-10-11T00:00:00Z",
   "decided_by": "human",
   "note": "Adapt into original words per PIPELINE.md. Link as source if adapted.",
   "activity_id": "coping-strategy-cards",
   "approved_via": "scout",
   "reviewed": "2026-10-11"
  },
  {
   "id": "8991075e7c5e995d",
   "title": "Free Printable Anti-Bullying Posters for Your Classroom",
   "source_url": "https://www.weareteachers.com/anti-bullying-posters-decor/?utm_source=rss&utm_medium=rss&utm_campaign=anti-bullying-posters-decor",
   "feed": "WeAreTeachers",
   "decision": "approve",
   "decided_at": "2026-10-11T00:00:00Z",
   "decided_by": "human",
   "note": "Adapt into original words per PIPELINE.md. Link as source if adapted.",
   "activity_id": "kindness-poster-campaign",
   "approved_via": "scout",
   "reviewed": "2026-10-11"
  },
  {
   "id": "c50e07d2fbaa76b6",
   "title": "111 Cool Winter Jokes To Break the Ice",
   "source_url": "https://www.weareteachers.com/winter-jokes/?utm_source=rss&utm_medium=rss&utm_campaign=winter-jokes",
   "feed": "WeAreTeachers",
   "decision": "approve",
   "decided_at": "2026-10-11T00:00:00Z",
   "decided_by": "human",
   "note": "Adapt into original words per PIPELINE.md. Link as source if adapted.",
   "activity_id": "winter-joke-slam",
   "approved_via": "scout",
   "reviewed": "2026-10-11"
  },
  {
   "id": "583bc578303240ef",
   "title": "15 Thanksgiving Bulletin Boards Teachers Will Love (Plus Free Printables)",
   "source_url": "https://www.weareteachers.com/17-thanksgiving-bulletin-boards-and-door-decorations-to-celebrate-gratitude/?utm_source=rss&utm_medium=rss&utm_campaign=17-thanksgiving-bulletin-boards-and-door-decorations-to-celebrate-gratitude",
   "feed": "WeAreTeachers",
   "decision": "approve",
   "decided_at": "2026-10-11T00:00:00Z",
   "decided_by": "human",
   "note": "Adapt into original words per PIPELINE.md. Link as source if adapted.",
   "activity_id": "gratitude-door-decor",
   "approved_via": "scout",
   "reviewed": "2026-10-11"
  },
  {
   "id": "6c0cae58691dbd70",
   "title": "130+ Best Argumentative Essay Topics for Students (Plus Free Worksheets)",
   "source_url": "https://www.weareteachers.com/argumentative-writing-prompts/?utm_source=rss&utm_medium=rss&utm_campaign=argumentative-writing-prompts",
   "feed": "WeAreTeachers",
   "decision": "approve",
   "decided_at": "2026-10-11T00:00:00Z",
   "decided_by": "human",
   "note": "Adapt into original words per PIPELINE.md. Link as source if adapted.",
   "activity_id": "take-a-stand-debate",
   "approved_via": "scout",
   "reviewed": "2026-10-11"
  },
  {
   "id": "803a073101ef79da",
   "title": "The Best Thanksgiving Poems for Kids of All Ages",
   "source_url": "https://www.weareteachers.com/thanksgiving-poems-for-kids/?utm_source=rss&utm_medium=rss&utm_campaign=thanksgiving-poems-for-kids",
   "feed": "WeAreTeachers",
   "decision": "approve",
   "decided_at": "2026-10-11T00:00:00Z",
   "decided_by": "human",
   "note": "Adapt into original words per PIPELINE.md. Link as source if adapted.",
   "activity_id": "poetry-share-circle",
   "approved_via": "scout",
   "reviewed": "2026-10-11"
  },
  {
   "id": "1d55acad5841fccc",
   "title": "Samsung Solve for Tomorrow Is Back, and 500 Schools Will Win!",
   "source_url": "https://www.weareteachers.com/solve-for-tomorrow/?utm_source=rss&utm_medium=rss&utm_campaign=solve-for-tomorrow",
   "feed": "WeAreTeachers",
   "decision": "reject",
   "decided_at": "2026-10-11T00:00:00Z",
   "decided_by": "human",
   "note": "Adapt into original words per PIPELINE.md. Link as source if adapted.",
   "activity_id": null,
   "approved_via": null,
   "reviewed": "2026-10-11"
  },
  {
   "id": "8b1aaaff02986dad",
   "title": "77 Best Short Stories To Teach in Middle School",
   "source_url": "https://www.weareteachers.com/best-short-stories-for-middle-schoolers/?utm_source=rss&utm_medium=rss&utm_campaign=best-short-stories-for-middle-schoolers",
   "feed": "WeAreTeachers",
   "decision": "reject",
   "decided_at": "2026-10-11T00:00:00Z",
   "decided_by": "human",
   "note": "Adapt into original words per PIPELINE.md. Link as source if adapted.",
   "activity_id": null,
   "approved_via": null,
   "reviewed": "2026-10-11"
  },
  {
   "id": "d209d3a300f7d1b5",
   "title": "Fun Fall Find the Letter on the Pumpkin Activity for Preschoolers",
   "source_url": "https://handsonaswegrow.com/find-letter-pumpkin/",
   "feed": "Hands On As We Grow",
   "decision": "approve",
   "decided_at": "2026-10-11T00:00:00Z",
   "decided_by": "human",
   "note": "Adapt into original words per PIPELINE.md. Link as source if adapted.",
   "activity_id": "pumpkin-letter-hunt",
   "approved_via": "scout",
   "reviewed": "2026-10-11"
  },
  {
   "id": "9d6833f2c46c6fbd",
   "title": "Improve Kids Fine Motor Skills with 30 Materials & Activities",
   "source_url": "https://handsonaswegrow.com/fine-motor-skills-activities/",
   "feed": "Hands On As We Grow",
   "decision": "reject",
   "decided_at": "2026-10-11T00:00:00Z",
   "decided_by": "human",
   "note": "Adapt into original words per PIPELINE.md. Link as source if adapted.",
   "activity_id": null,
   "approved_via": null,
   "reviewed": "2026-10-11"
  },
  {
   "id": "3a29a488eed178f3",
   "title": "28 No Carve Pumpkin Decorating Ideas for Kids",
   "source_url": "https://handsonaswegrow.com/no-carve-pumpkin-decorating-kids/",
   "feed": "Hands On As We Grow",
   "decision": "reject",
   "decided_at": "2026-10-11T00:00:00Z",
   "decided_by": "human",
   "note": "Adapt into original words per PIPELINE.md. Link as source if adapted.",
   "activity_id": null,
   "approved_via": null,
   "reviewed": "2026-10-11"
  },
  {
   "id": "055ace876357734d",
   "title": "Nature Walk Scavenger Hunt: Leaf Counting",
   "source_url": "https://handsonaswegrow.com/nature-walk-scavenger-hunt-leaf-counting/",
   "feed": "Hands On As We Grow",
   "decision": "reject",
   "decided_at": "2026-10-11T00:00:00Z",
   "decided_by": "human",
   "note": "Adapt into original words per PIPELINE.md. Link as source if adapted.",
   "activity_id": null,
   "approved_via": null,
   "reviewed": "2026-10-11"
  },
  {
   "id": "147c7792763b202e",
   "title": "Make a Spider Web to Learn Letter S",
   "source_url": "https://handsonaswegrow.com/make-spider-web-activity/",
   "feed": "Hands On As We Grow",
   "decision": "reject",
   "decided_at": "2026-10-11T00:00:00Z",
   "decided_by": "human",
   "note": "Adapt into original words per PIPELINE.md. Link as source if adapted.",
   "activity_id": null,
   "approved_via": null,
   "reviewed": "2026-10-11"
  },
  {
   "id": "526b06095852036d",
   "title": "Homemade Christmas Ornaments for Kids to Make",
   "source_url": "https://handsonaswegrow.com/homemade-christmas-ornaments-kids/",
   "feed": "Hands On As We Grow",
   "decision": "approve",
   "decided_at": "2026-10-11T00:00:00Z",
   "decided_by": "human",
   "note": "Adapt into original words per PIPELINE.md. Link as source if adapted.",
   "activity_id": "homemade-christmas-ornaments",
   "approved_via": "scout",
   "reviewed": "2026-10-11"
  },
  {
   "id": "c8c702f8d6786f62",
   "title": "Learning Activity with Dominoes",
   "source_url": "https://handsonaswegrow.com/learning-activity-with-dominoes/",
   "feed": "Hands On As We Grow",
   "decision": "reject",
   "decided_at": "2026-10-11T00:00:00Z",
   "decided_by": "human",
   "note": "Adapt into original words per PIPELINE.md. Link as source if adapted.",
   "activity_id": null,
   "approved_via": null,
   "reviewed": "2026-10-11"
  },
  {
   "id": "ccf3d96f00dcab00",
   "title": "Decoder Wheel Printable: Make Your Own Secret Code Wheels",
   "source_url": "https://teachbesideme.com/decoder-wheel-printable/",
   "feed": "Teach Beside Me",
   "decision": "approve",
   "decided_at": "2026-10-11T00:00:00Z",
   "decided_by": "human",
   "note": "Adapt into original words per PIPELINE.md. Link as source if adapted.",
   "activity_id": "secret-code-decoder-wheels",
   "approved_via": "scout",
   "reviewed": "2026-10-11"
  },
  {
   "id": "28b2bd46e2841a35",
   "title": "The Scream Art Project for Kids + Free Printable",
   "source_url": "https://teachbesideme.com/the-scream-art-project-for-kids-free-printable/",
   "feed": "Teach Beside Me",
   "decision": "approve",
   "decided_at": "2026-10-11T00:00:00Z",
   "decided_by": "human",
   "note": "Adapt into original words per PIPELINE.md. Link as source if adapted.",
   "activity_id": "expressionism-scream-art",
   "approved_via": "scout",
   "reviewed": "2026-10-11"
  },
  {
   "id": "ea3976767a0913a3",
   "title": "Maryland State Geography for Kids: Printable Learning Pack",
   "source_url": "https://teachbesideme.com/maryland-state-geography-for-kids-printable-learning-pack/",
   "feed": "Teach Beside Me",
   "decision": "reject",
   "decided_at": "2026-10-11T00:00:00Z",
   "decided_by": "human",
   "note": "Adapt into original words per PIPELINE.md. Link as source if adapted.",
   "activity_id": null,
   "approved_via": null,
   "reviewed": "2026-10-11"
  },
  {
   "id": "c186a2dc2d07f392",
   "title": "Dinosaur Pattern Block Mats: Hands-On Math Activity",
   "source_url": "https://teachbesideme.com/dinosaur-pattern-block-mats-hands-on-math-activity/",
   "feed": "Teach Beside Me",
   "decision": "approve",
   "decided_at": "2026-10-11T00:00:00Z",
   "decided_by": "human",
   "note": "Adapt into original words per PIPELINE.md. Link as source if adapted.",
   "activity_id": "dinosaur-pattern-blocks",
   "approved_via": "scout",
   "reviewed": "2026-10-11"
  },
  {
   "id": "27dca6b7ee1763b3",